{
  "schemaVersion": "1.0",
  "device": {
    "modelIdentifier": "iPhone15,4",
    "ppi": 460,
    "nativeScale": 3
  },
  "acuity": {
    "source": "measured",
    "logMAR": -0.05,
    "ci95": [
      -0.15,
      0.05
    ],
    "reliability": "reliable",
    "flags": [],
    "whoCategory": "none",
    "trials": 24,
    "displayLimitLogMAR": -0.02,
    "censoredAtDisplayLimit": true
  },
  "contrast": {
    "source": "measured",
    "logCS": 1.85,
    "ci95": [
      1.75,
      1.95
    ],
    "reliability": "reliable",
    "flags": [],
    "band": "normal",
    "trials": 20,
    "ceilingLogCS": 2.04,
    "censoredAtCeiling": false
  },
  "summary": {
    "normalVision": true,
    "overallReliability": "reliable"
  }
}
