{
  "schemaVersion": "1.0",
  "device": {
    "modelIdentifier": "iPhone15,4",
    "ppi": 460,
    "nativeScale": 3
  },
  "acuity": {
    "source": "measured",
    "logMAR": 0.4,
    "ci95": [
      0.3,
      0.5
    ],
    "reliability": "reliable",
    "flags": [],
    "whoCategory": "mild",
    "trials": 24,
    "displayLimitLogMAR": -0.02,
    "censoredAtDisplayLimit": false
  },
  "contrast": {
    "source": "measured",
    "logCS": 1.3,
    "ci95": [
      1.1,
      1.45
    ],
    "reliability": "doubtful",
    "flags": [
      "wideInterval"
    ],
    "band": "reduced",
    "trials": 20,
    "ceilingLogCS": 2.04,
    "censoredAtCeiling": false
  },
  "summary": {
    "normalVision": false,
    "overallReliability": "doubtful"
  }
}
